house_id,overview
55397269,"Live in the heart of all that Willy St has to offer! You'll fall in love with the tall ceilings, maple hardwood floors, double sided fireplace, and modern updates in this gorgeous condo.   A large bedroom and bathroom give you plenty of personal space while the kitchen and living area give you room to entertain. In unit laundry and underground, heated parking give you easy day to day living. A large storage space with light + electricity is a great added bonus for a small workshop or space to keep your things! Fresh paint, updated appliances, and a new A/C and roof leave you with peace of mind. You'll be able to move in and make this condo home right away!Read more"
448478,"Welcome to the Stylish 1 BR/ 1 BA Condo in the Well Managed & Maintained 166-unit Mid Century Modern  Garfield Condominium. Condo Fee Includes All Utilities:  Gas, Electricity, Water & Sewer, Trash/Recycling and Snow Removal; as well as the Many Building Amenities:  24/7 Front Desk/Concierge, On -Site Manager, Amazing Roof Deck,  Gym, Meeting Room,  Laundry Room and  2 Elevators. Fully Renovated Large 867 Sq foot Unit, this Unit has an Abundance of  Windows & Closets as well as Wall Space and Built-Ins Ideal for Displaying Artwork. Appealing Floor Plan and Define Spaces in the Living and Dinning Areas. **Newly Updated Kitchen**Stainless Steel Appliances**Premium Fully Renovated Bathroom **Gleaming  Engineered Hardwood Floors**Tons of Storage Space** Located in the Premium Tier on the quiet side of the building with Large Windows throughout filling the Home with Natural Light. Super convenient Location Just Blocks From the Many Shopping, Dining, & Community Amenities of Chevy Chase DC -- Over 50 Opportunities to ""Shop Local"" along Connecticut Ave. And, the Friendship Heights Metro and the Surrounding Shops and Restaurants are Only 5 blocks away. The Garfield has a No Pet Policy.  Call  Showing Contact for Combo Code.Read more"
43691309,"Wonderful 3/2 home in the Pace Island! Ceramic plank floors in kitchen and family room.Kitchen overlooks family room. Separate formal living and dining rooms. Spacious owners suite and bathroom. Bathroom boasts two separate vanities, garden tub and separate shower stall.Two guest bedrooms and guest bath. Home is located on a large corner lot. Fenced in backyard.Enjoy your free time at the amenities Pace Island has to offer. Pool, tennis and basketball courts! 24 hr guard at gate.Close to NAS Jax. Minutes to great shopping and restaurants!Read more"
55397043,"If these walls could talk they'd say BUY ME! All of the heavy lifting has been done & character preserved in this 4 bd/1.5 ba home, located in popular Tenney Park area. Traditional layout w/~2,000 SqFt of living space over 3 stories! Fully remodeled kitchen offers a great layout, new cabinets, backsplash, granite ctrs & GE Cafe SS appliances. Add features incl original molding, trim, doors & hardware, refinished hardwoods, high ceilings, built ins, fresh landscaping, new decks (front & back), wood stove, 200 amp electric, PEX plumbing, upgraded bath, new ½ bath, main floor laundry, newer mechanicals (furnace, AC, water heater) & roof, new windows & fresh paint throughout. 1 car garage, add prkg pad & cute yard! Great urban location near E Johnson St eateries, Tenney Park & near downtown!Read more"
15151214,"Great things come in small packages! This is certainly true of this charming Mission District single family home just steps away from some of the best restaurants in San Francisco.  Flooded with natural light from multiple skylights, this jewel box house is truly the perfect condo alternative.  The centerpiece of the home is the terrific landscaped yard with a darling seating area in rear.  The main level consists of a beautiful kitchen with stainless steel appliances and marble countertop, living area, bar seating, dining area, bedroom with high ceilings, and bathroom with shower over tub.  On the lower level is an unwarranted room and full bath (staged as a bedroom) and perfect for an office, exercise room or multiple other possibilities.  Garage, storage and laundry complete this level.  It's rare to find such a complete package with so much charm in such a desirable location. This house is truly special.Read more"
104460216,"Beautiful 11th floor 1-bedroom + study with Lake Monona views offers the best in city living 3 blocks from the Square! Located close to the University, both lakes, the public library and all downtown restaurants and events, this attractive condo offers maple hardwood floors, cherry cabinets, granite counters, SS appliances with gas stove, walk-in closet, private deck + separate storage. New carpet in master bedroom and freshly painted living room+kitchen. Exceptional building amenities too: onsite property management, fitness center, 1-acre park, guest parking + dog run. Parking space #2048 located on level P2 - parking condo fee $40.93. Storage Unit #347 located on the 3rd floor.Read more"
245677620,"This 1578 square foot single family home has 3 bedrooms and 3.0 bathrooms. This home is located at 2665 W Maypole Ave, Chicago, IL 60612.Read more"
89921434,"SPECTACULAR CORNER PENTHOUSE UNIT!! OFFERING NORTH & EAST VIEWS!! STUNNING AND MOVE IN READY 2 BEDROOM/2 BATHROOM SECURE (GATED) ASSIGNED PARKING SPOT INCLUDED IN THE PRICE!    THIS IS ONE OF THE BEST UNITS IN THE BUILDING! TOP FLOOR, CORNER UNIT BRINGS IN SO MUCH NATURAL LIGHT AND SOME OF THE BEST VIEWS!! THE SUN DRENCHED LIVING ROOM & DINING ROOM HAS AIRY AND ASCENDING CATHEDRAL CEILINGS, JULIET BALCONY AND A BEAUTIFUL FIREPLACE! HARDWOOD FLOORS & FRESH TRENDY PAINT THROUGH OUT THE ENTIRE UNIT. KITCHEN OFFERS 42"" MAPLE CABINETS, GRANITE COUNTERTOPS, WATER FILTRATION SYSTEM IN THE KITCHEN SINK AND SO MUCH PREP SPACE! WAKE UP IN THE MASTER BEDROOM WITH A VIEW OF THE SEARS TOWER EVERY MORNING!! AWESOME WALK IN CLOSET AND EN SUITE MASTER BEDROOM BATH WITH DOUBLE VANITY SINKS AND JACUZZI TUB! FULL BALCONY ACCESS OFF THE MASTER BEDROOM WITH BEAUTIFUL SKYLINE VIEWS. BEDROOM 2 OFFERS SO MUCH SPACE AND NATURAL LIGHT. IN UNIT FULL SIZE WASHER AND DRYER IN THE LAUNDRY ROOM!! NEST THERMOSTAT! WELL MAINTAINED BUILDING GREAT FOR INVESTORS OR HOME OWNERS! TRI-TAYLOR AREA IS ONE OF THE HOTTEST NEIGHBORHOODS IN THE CITY! ENCOMPASSED BY NEW CONSTRUCTION ON JUST ABOUT EVERY BLOCK! CLOSE TO EXPRESSWAYS 90/94, 290 & 55, BLUE LINE, PINK LINE BUS STOPS, DOWNTOWN CHICAGO, UIC, RUSH/ILLINOIS MEDICAL DISTRICT, UNITED CENTER, UNIVERSITY VILLAGE, TAYLOR STREET & LITTLE ITALY. EASY ACCESS TO THE LOOP, WEST TOWN,  SOUTH LOOP, PILSEN, SEVERAL LOCAL HOSPITALS, RESTAURANTS, ROOSEVELT COLLECTION, COSTCO, WHOLE FOODS & SO MUCH MORE!! IMMEDIATE CLOSE POSSIBLE!!Read more"
439323,"Wonderful opportunity to live in Friendship Heights! This gorgeous fully renovated four-story semi-detached home has it all! The open contemporary floor plan grants enough space for dining, living, and a beautiful chef's kitchen with wrap-around windows and french doors that opens up to an expansive deck suited for all of your entertaining. The soaring 9-foot ceilings, lovely hardwood throughout, and the abundance of windows really provides a light and airy feel! Attention to detail was not overlooked in any aspect of this renovation you'll notice it through the custom stair railing and, stunning tiling! The lower level boasts 8.5-foot ceilings, custom wet bar, guest suite, a ton of extra storage, and access to additional private outdoor space. The sizable yard and off-street parking complete your new home!Read more"
20690565,"Probate Sale! Single Family Residence featuring 2 bedrooms and 1 bathroom +/- 576 SF of living on a +/- 7,083 SF corner lot! APN: 5307-018-025.  THIS PROPERTY IS BOARDED UP/ THERE WILL BE NO INTERIOR ACCESS, LAND VALUE ONLY. This property is offered together with improvements thereon as is, where is, with no warranty expressed or implied. This is an ""All Cash Sale"" , subject to court confirmation and overbid. (Timing of hearing is subject to the courts calendar- approximately 4-6 months)  Submit all offers on the Seller's Offer to Purchase Contract with proof of funds by October 17th 2020. ALL VISISTORS must sign a PEAD form prior to entering the property. Everyone must follow LA City CDC guidelines  Please review private remarks.Read more"
3874726,"Rare Landmark District offering by Vari Architects, exceptional newly rehabbed historic row home in the heart of the Tri-Taylor/Medical District neighborhood is a must see! It is a brick Victorian row home with all the modern finishes of new construction without losing any of the original historic charm the neighborhood is known to have. Built in the 1880s this row home is a legal 2 flat comprised of a 3 bed/2.5 bath duplex-up owner's unit and a generous 1 bed/1 bath garden rental unit. The owner's unit features soaring ceiling heights, exposed brick in the large living room, a fireplace, beautiful hardwood floors throughout, large front bay windows looking over the quiet tree lined street and ample closet space, in-unit washer and dryer and the original arched entry door and window details. The modern kitchen has ample quartz countertop space, shaker cabinets offering abundant storage, stainless steel Whirlpool appliances, and a large island with bar seating. The kitchen leads into a light filled and expansive sunroom/mudroom, rear deck and then out into the private garden. The back garden is a beautiful, low maintenance space with a large tree, flower bed, artificial turf and pavers for relaxing and entertaining with friends and family. The baths are bright and modern, offering a large walk in shower, soaker tub, quartz counters and beautiful tile. The garden unit's style and high-end finishes reflect that of the owner's unit. Modern kitchen with flat panel cabinets, quartz counter tops, Whirlpool appliances, large living room space with a fireplace, wood grain flooring throughout, in-unit laundry, mud room and separate mechanicals. The rental unit has great rental income potential, but can also be used as an in-law suite for family, housing for nanny/care givers, private quarantine office space, or as an Airbnb. So many great options! The home includes two parking spots for everyone's parking needs. This home is just steps to the Blue Line and CTA stop, quick access to I-290 to get downtown or the western suburbs, walking distance of the Medical District, excellent dining and shopping, public parks and so much more! Everything inside and out shows quality workmanship and the love of historic details combined with all the modern comforts. Sale includes HWA 1-year home warranty.Read more"
295357473,"Opportunity to purchase a duplex on a corner lot. The (2)Bd/1ba has washer/dryer hookups, separate backyard, ample parking. The 1Bd/1Ba has separate backyard and ample parking. Zoned R3. Property offers great potential to a purchaser seeking to add value. LOWEST PRICED DUPLEX in Lemon Grove.Read more"
27323931,"BEAUTIFUL 1 STORY 4-2 HOME PERFECTLY LOCATED FOR NORTH DALLAS COMMUTERS. 5-10 MINS FROM PGBT,DNT AND I-35. HUGE FAMILY ROOM WITH HIGH CEILING, WET BAR. Masterr SUITE INCLUDES CUSTOM SHOWER. Don't wait on this one!!Read more"
29333056,"Built from cream and gray Texas Hill Country limestone in the style of a European mansion house and set in the sunny hills of Barton Creek with views over the OMNI hotel and country club at the rear, while the front garden offers privacy from the road and features many trees, a stocked carp pond and fountain and a small boules or pétanque piste that leads down to the third hole of Fazio Hills golf course.
                
                Floors are 3/4"" solid mahogany throughout except the second kitchen, bathrooms and laundry. Windows and doors all from Andersen except the purpose-built, castle-style wrought front doors.
                
                At the rear, the pool deck and entertainment area is built from Mexican marble and limestone, with the well-fed pool 9' at the deepest with a waterspout feature and a separate large spa. The deck is sealed by gates and is finished off with a shaded lounging area above it and a full sized sunken boules piste with a music system and small bar & grill.
                
                The outdoor space continues below the pool deck to a relatively flat area that opens out to the third hole of the Fazio Hills golf course, so close, a quick hole or two in the morning or evening is not out of the question. 
                
                The land is large enough for a tennis court to be built, or sports hall, bunkhouse, etc due to the lifting of a building-line restriction a few years ago. 
                
                It then flows down fairly steeply to a small dry creek that is the property boundary. Lots of wildlife and lost golf balls.
                
                The first floors of the house are covered with oriental rugs and traditional-to-modern furniture, mostly sourced from eg Louis Shanks.
                
                The main kitchen is a recent addition fitted with an oversize sink, two dishwashers, a hidden sink, and appliances from Miele and Thermador. It moves through to a mirrored dining area that itself gives way to a full wet bar, True ice-maker, wine fridges, beer fridges, and seating for 18 or so.
                
                There is a whole-house music system and an additional Sonos system in Library, Bar, Kitchen, and lounge. Cable supplies all connectivity via Spectrum (house wired for cable TV but not used).Read more"
43708313,"This home is vacant and ready to move into.  Pure privacy in Fleming Island, no CDD fees or HOA fees.  This listing includes the property to the right as you cross the bridge, the lot that Residence sets on and the .28 acre lot to far side of the residence. So in total there are 3 parcels. Vinyl flooring in kitchen, breakfast nook, laundry and hall has been replaced.  The dishwasher is also new.Very open floor plan with Screened patio overlooking the woods and wildlife. More pictures of vacant land coming.Read more"
7512091,"I am so excited for the new owners of this home!  It is fully renovated and, the finishes and the upgrades are very tastefully done.  This is practically brand new!  New roof, complete electrical rewire. A/C, drywall, flooring, bathrooms and kitchen, windows and many more.  This has a tankless water heater and indoor laundry.  You really need to see it.  It's close to downtown Phoenix and easy access to pretty much everything.  Make your appointment today.Read more"
121073218,"Right down the street from West Loop, this 3bed/2bath Westhaven Park condo offers an impressive list of upgrades! The bright, open layout includes a gas fireplace and a sizeable balcony, all enhanced by new light fixtures and fresh paint throughout. Enjoy a spacious dining area overlooking the kitchen with granite countertops and brand new stainless steel appliances. Hardwood floors in the main living space with new carpet in the generous-size bedrooms, along with in-unit washer/dryer. Also included are 2 parking spaces- one garage/one outdoor. This pet-friendly building is just a few blocks from the United Center and 2 blocks to the Green line el stop!Read more"
102959965,"Enjoy bold modern architecture/design in combination w/the hottest location in downtown Madison! This impressive 2bd/1ba corner unit at Capitol West makes a statement! Open concept FP offers a stunning kitchen w/custom cross cut cabinetry, walnut trim/accents, quartz ctrs, kohler/grohe fixtures, contemporary lighting & SS appliances w/gas range & vent hood. Add features & upgrades include wood/tile flooring, FP w/tile surround, custom built-ins, high ceilings, lovely color palette/paint accents, large bathroom w/double vanity, laundry & big walk in shower, large balcony w/pretty views, on-floor storage & underground parking. Guest room has built-in murphy bed & shelving. Great amenities (onsite mgt, fit & biz ctrs) & superb DT Madison location! SF per orig FP (NAHB ANANSI Z765 std)Read more"
26819039,"This gorgeous two story home located on a huge corner lot in the St. Augustine Park Estates. As soon as you walk in you are presented the charming first floor living and dining area, with luxury tile floors throughout, granite countertops, wooden kitchen cabinets with a breakfast bar & gas stove with pot filler, & a beautiful staircase. This home is 4 bedrooms, 3 baths, includes a master bedroom with a walk in closet, a stand up shower with extravagant tile work showcased in all showers, a study & a huge 2nd floor living space. Need a big backyard with easy access to bring any big trailers or park multiple cars, this property is ideal for that or just a nice private place to enjoy in your down time.Read more"
15072751,"Welcome to this bright 1 bed 1 bath home with floor to ceiling windows in one of Pacific Heights most prestigious full service buildings. This home features an open floorplan with a large dining/living room that leads to a sunroom with views of our gorgeous San Francisco Bay and Marin! Amenities include a walk-in closet, a generous parking space in a secure garage, deeded storage, elevators, doorman service and a spectacular shared roof deck with iconic views of the Bay, the Golden Gate Bridge and San Francisco. Walking distance to Union Street, Fillmore Street, Polk Street and three blocks from Lafayette Park.Read more"
26818496,"Fresh everything, just remodeled, fresh flooring, paint and more, 4 bedroom, kitchen has new appliances, and huge Island, open to living and dining area, corner lot, bedrooms split for privacy.Read more"
36730425,"Impeccably maintained is what defines Cygnet Drive.   Move right into this home, located in a well established community, just minutes from shopping, dining, grocery stores and more!!  Natural gas welcomes you in and the real hardwood floors greet you at the front door, following you back into your kitchen that comes with SO much cabinet space. Gorgeous granite counters, stainless steel appliances and a beautiful window that gives you a view of your relaxing backyard. This backyard has the perfect set up for any homeowner: an in-ground pool, deck, awning and still so much usable space for more activities of your liking! The master suite is one that you have been waiting for...a huge closet, a bathroom with 2 sinks, a large soaking tub and ceiling height that you dream of! Carpets have just been cleaned and are ready for its new owner. Don't wait on this one!!Read more"
60136219,"Fantastic 2-story home in sought after Travis Country West. 3 bedrooms + 1 office/bedroom, upstairs game-room, magazine worthy kitchen, and private backyard. Wonderful neighborhood with community pool, playground, basketball court, and hike & bike trails! Homes are selling quickly in Travis Country West - don't miss out on this gem!Read more"
19607297,"Crisp 1950s ranch-style home with tons of curb appeal! Situated on a fully manicured park-like property, this 1,511sf 3-bed/2-bath charmer is updated inside and out with no loss to its original mid-century appeal. A bright formal living room w/newly finished hardwood floors accentuate the rooms original brick fireplace and diamond muntin windows. The formal living room and large family room are connected by a central dining area w/large pass-through kitchen. When the weathers nice, throw a party that flows seamlessly out to the immaculate backyard where theres space to play on the lush lawn, grill on the brick patio, or simply sit and relax. Theres even a place to plant your favorite veggies and herbs! Mature trees surround the yard.The home boasts 2 fresh spa-like bathrooms with subway tile, an HVAC, 2 original brick fireplaces, stainless steel appliances, and new kitchen countertops. Close to Valley Fair, Santana Row, and major freeways.Move right in and make this home your own!Read more"
2077554927,"Live the Eagle Harbor resort lifestyle in this impeccably maintained home on a large, beautifully manicured corner lot. With high ceilings and lots of natural light, this nicely appointed home features a new roof, plantation shutters, crown molding and new bamboo flooring. The updated kitchen features granite countertops, subway tile and stainless steel appliances. Master bedroom boasts dual closets, dual vanities, soaker tub and walk in shower, with the second bedroom featuring an ensuite bath. All this with award winning schools and Eagle Harbor amenities. Enjoy numerous recreation options including swimming in three pools, (one with a water slide and high dive), join a tennis league, play 18 holes at Eagle Harbor Golf Club, or enjoy a day on the water on Doctors Lake. Welcome home!Read more"
7515311,"Hard to find 3 bed-2 bath-rehabbed home on large R5 lot in area of growth and new construction. Property is leased month to month at $1,150 and tenant pays utilities. Versatile property as an investment, owner occupied or value add with room for additional units. Property is close to downtown amenities and easy access to the 17. List of upgrades in Documents. No Lockbox..24hr noticeRead more"
29331251,"Truly magnificent French Château on 1.5+ acres backs to Fazio Foothills in gated pocket within Barton Creek. Exquisitely designed with distinguished taste: French antique marble fireplaces, Turkish travertine, Brazilian Ipe floors, Mahogany doors, Lueders Limestone, antico marble counters, Phylrich, Schonbek & more! Spacious secondary bedrooms, fitness + sauna, elevator, den/formal living, wet bar + wine cellar. Immaculate grounds w/cabana, summer kitchen, & pool bath w/steam shower. Sensationnel!Restrictions: Yes  Sprinkler Sys:YesRead more"
17112435,"Buy this foreclosure deal the right way. Visit us at Auction.com, then login or create a free account to save this property and receive important alerts. We'll let you know if the Est. Credit Bid has posted, when the property has cleared for sale, is postponed or canceled, and the property's winning bid amount if it sells. Auction.com is your source for 30,000+* discounted foreclosure and bank-owned properties and auction events nationwide. Find the best deals in your market now. *Based on data from August 2019.Read more"
20788262,"This 2789 square foot multi family home has 5 bedrooms and 4.0 bathrooms. This home is located at 1205 N Orange Grove Ave, West Hollywood, CA 90046.Read more"
81944512,"Welcome to the Nolen Shore Townhomes. 3 story living w/ private entrance! Great office space, full bath, laundry & access to the underground parking garage on the entry level. 2nd floor features an open floor plan w/ open kitchen featuring s/s appliances & ample dining space. Living room includes surround sound, awesome windows providing abundant natural light & the outdoor patio which opens up to the Nolen Shore courtyard. 3rd level has 2 bedrooms both en suite style w/ their own bath. Perfect for guests when they come to visit. Amenities w/ the building are a guest suite for overnight guests instead of using a hotel, fitness room and a conference room overlooking Lake Monona. All within just a few blocks of Capitol Square, downtown dog park, & Lake Monona. Downtown living at its finest!Read more"
449003,"Arguably the best offering in the building, this unit features the largest floor-plan! This sun-drenched home shines with modern and thoughtful updates throughout. Highlights include hardwood floors, updated bath and kitchen, custom closet system, light fixtures, fans, hardware, and updated windows to enhance energy efficiency. The kitchen features granite counter-tops, stainless steel appliances, and designed to maximize space and functionality. Separately deeded parking space included in the sales price!  Pet-friendly building. All utilities included in low condo fees only pay for the internet! Exclusive location! Within a close walk  to Safeway, Starbucks, restaurants, shopping, entertainment, and the best of Chevy Chase and Friendship Heights, less than a mile to Friendship Heights metro! See Virtual Tour to appreciate the floorplan.Read more"
101377273,"This Modern two bedroom, two bathroom condo features an open floor plan, granite counters, two full bathrooms, one of which is part of an expansive En-suite master bedroom with walk in closet. More features include - in unit washer dryer, central HVAC system, balcony, storage room, & heated garage parking. One Park Place is a newer modern condo complex quality built less than 13 years ago, this property features clean modern common areas with secured front entrance, surveillance cameras, storage, & indoor heated garage parking. Prime location near O'Hare airport, major Interstates of course, & Less than a five minute walk to the Schiller Park Metra station. This condo community is already home to many airport professionals & service providers. Park One Place can not be beat for location! & Price per sqft on a modern building with today's standards of living. Book your private tour today.Read more"
83813569,"Captivating and private 2.25-acre lot with incredible, dramatic views of a 1000+ acre nature preserve as the setting in the exclusive gated community of Verano, Barton Creek. Designed with a nod to elegant French design by world renowned architect Dan Sater, this estate features a well-appointed kitchen, study, media, and wine room. Private guest apartment with separate entrance includes a full kitchen, bath, bedroom and living area. Pool, fire-pit, screened-in summer kitchen and dining area, air conditioned 4 car garage for car enthusiasts.Read more"
