house_id,overview
26947300,"Incredible Real Estate pressed against acres of rolling hills. You'll see from the tops of this neighborhood you're not just anywhere! Home of gorgeous views and breathtaking sunsets. Walk the lake or take a stroll over to Nob Hill Greenbelt. Large living areas. Oversized Kitchen neatly tucked away with a nice private dining. Vaulted ceilings with Recessed and updated lighting. Low maint. wood flrs, super easy to clean. Efficient and low maintenance pool perfect for Texas Summer Days+! Lucious landscaping in this backyard getaway seems Ideal for social distancing. 4th bedroom with tall ceilings perfect for a study. With new colors and incredible décor. You don't want to miss this homes opportunity! Won't lastRead more"
36731224,"Welcome home to this lovely 3 bedroom, 3.5 bath townhome! 2 large master suites with vaulted ceilings. Spacious kitchen with island and newer appliances. New windows, New Dryer, Furnace 4 years old. Fully finished basement with 3rd bedroom, full bath and bonus room. Conveniently located in Waldorf. Close to schools, shopping, restaurants, and more!Read more"
26817292,****************BACK ON THE MARKET DO TO BUYER FAMILY ISSUES**MUST TO SEE THIS BEAUTIFUL HOME***FULLY UPDATED WITH NEWISH ROOF** LAMINATED FLOORS** KITCHEN CABINETS** LIGHT FIXTURES** FRESH PAINT** LARGE WELL KEPT FENCED YARD FOR FAMILY GATHERINGS** AND LOT MORE TO NAMED**Read more
306141859,"Our popular Cahaba is planned for construction on a large .412 acre wooded lot.  Fleming Estates is a new community close to the St Johns River with large wooded estate lots.  This home features an open concept, 4 bedrooms, 3 baths, formal dining room, study, 12' ceilings, chef's kitchen with Bosch appliances and walk in pantry, coffered ceilings with crown and pocket slider in gathering,  walk in closets in all bedrooms, oversized master with bay window, tray ceiling with crown, double closets and a 3 car side entry garage.  The price reflects home as built with community included features and incentives applied to price.  The Builder pays $7000 in closing costs with Preferred Lender.  **Photo of similar home**  Floor plan in Documents,Read more"
20784322,"Two story modern architectural in the heart of Melrose Village. Dramatic staircase, soaring ceilings, open floorplan with a gorgeous kitchen, Thermador stainless steel appliances, 6 burner stove, a large center island with sink and microwave. Downstairs has an en-suite bedroom that can be used as an office, guest, or nanny's room. Sliding glass doors in Living room flow out to the covered patio, BBQ, infinite pool and spa. Wonderful for entertaining. Sexy master bedroom with high ceilings, 2 huge walk in closets and large terrace overlooking the back yard, Luxurious master bath with free standing tub and separate elegant shower plus double sinks with ample counter space. Additionally there are 3 en-suite bedrooms upstairs plus a den area. This home is wired for security, sound and smart home technology, everything you need and more. Amazing style and amazing value!Read more"
58297288,"7849 Escala Drive, Austin, TX 78735 A dream of a magical home, although; far from just a home... Your own private resort. The Eagle Ridge was designed as a place to enjoy a lifestyle of un-imaginable dreams, the kind of life that contains everything, the most magnificent amenities, private and community. Imagine a country club within a country club. The Eagle Ridge was chosen to present itself among the most sought after estate sites of a prestigious community. Multiple estate lots were selected from the development at early stages selecting the finest home sites and combined to form a special setting for what is now Eagle Ridge. An estate poised above the magnificent rolling hills in the immediate Austin, Texas Hill Country. The Home.... Perfectly re-designed by a master of her craft Renata Marsilli, A visionary of luxury construction, design, detail and beauty. A complete design re-vision inside and out was accomplished with today's desires of what an architectural vision should be. Finish design of incredible detail and alluring appeal. Location of Austin's elite... Poised behind the gates of Escala at Barton Creek. Possibly the most prestigious area Austin has to offer. A locale just outside of the city with amenities, space and beauty of the Hill Country. Desired by all... Attained by few. The estate is offered for the first time to the fortunate lifestyle dreamer.Read more"
7515443,"Beautiful home. Lovely kitchen with granite counter tops. Huge lot with basketball area, court yard great for entertaining, pool and lots of space for kids.  Close to schools, shopping, freeway, park and hospital 10 minute from downtown PhoenixRead more"
20785955,"Remodeled contemporary oasis with 14-foot privacy hedges outline this green wonderland for the utmost tranquility and security! Enter through a secure pedestrian gate to a French-countryside inspired courtyard. Multiple outdoor sitting areas, fire pit, multiple Redwood decks, grass, olive trees & privacy to bask in the sun in true French Riviera style. Main house consists of an open floor plan with 1,133 sq ft, white-washed French oak floors, Chef's kitchen with high-gloss white cabinetry, quartz countertops, stainless steel appliances, abundant natural light and two beds en suite. Detached fully permitted guest house consists of 840 sq ft, 9-foot ceilings, washer/dryer hook up, full kitchen and bath. Security cameras and electric gate for secure parking for two plus a 60 sq. ft. storage garage with compartments for tool organization. Incredible income potential with projected rental value of $12k/mo on a long-term basis. Virtual tour available.Read more"
82294487,"Prime location at the corner of Chevy Chase and DC....Luxury Style! Across from Friendship Heights Metro. One of a Kind Sun Splashed Corner Unit with 2 Bedrooms & 2 Bathrooms overlooking the gorgeous green park and greenery. Fabulous large balcony overlooks the peaceful flagstone terrace, waterwall and lush  park, tucked away from the main road for privacy. Windows on each of the 3 walls offer 3 different light exposures. This unit boasts the most unique layout in the building, with a pass through kitchen, built in granite covered desk, long Marble Entry Foyer, exotic hardwoods, custom cabinetry/shelving and designer granite in bathrooms. The spacious Master Bedroom features a walk-in closet, bathtub and granite covered shower with granite covered double vanity. The kitchen features Viking Appliances, Granite cover bar, upgraded lighting fixtures and gorgeous high end cabinetry. Coveys with 2 prime garage parking spaces-46 and 47- plus a storage unit. First Class Everything. Amenities include a spectacularly designed club room with kitchen, professional conference room, peaceful flagstone patio with relaxing waterfall fountain and bright and sunny fitness center. Professionally managed with an on site 24 hr Concierge, Steps from Upscale Shopping, Dining, Theater, Across the street from the Friendship Heights Metro! Once you buy into the Chase Point lifestyle, you will never want to leave!Read more"
55421174,"Great location & views of Lake Monona!! A wonderful 4 bed 2 bath 2-story in the Marquette neighborhood! Walk into the foyer and see all original hardwoods & great woodwork throughout! The main level boasts a large family room w/ fireplace, an office/den w/ French doors, a formal dining w/ built-ins, and a cozy kitchen space! The ML back door walks out to a 22X8 enclosed porch & an attached deck/patio! The UL has all bedrooms, including the main w/ a walk-in closet. There's also an awesome attic space w/ a lake view, waiting to be finished! The unfinished LL offers tons of storage & a bonus partially finished 22X19 studio space w/ separate entry! 1-car attached garage! UHP Warranty! Needs a little TLC & work, but has tons of potential & is steps to parks, co-op, restaurants, cafes, shops!Read more"
27326048,"Fall in Love with this absolutely Stunning Fabulous 3 Bed, 2 Bath Single Story Cul De Sac House awaits your approval. The neutral color scheme works beautifully with any décor & the abundance of windows invites the sun to fill each room with natural light. New wood floor and carpet. MOVE IN READY.Gas burning fire place with vaulted ceiling.Sepate utility room with built in cabinets.Colse to PGBT.Read more"
70747556,"This 3438 square foot single family home has 5 bedrooms and 3.0 bathrooms. This home is located at Country Side Dr, Fleming Island, FL 32003.Read more"
7514205,"Great opportunity! Remodeled in 2018, this home has plank wood look tile flooring, custom tile tub/shower, bright white kitchen cabinets with granite counter tops and a large lot. Double gates at front and rear of property. HVAC duct work redone in 2018 as well. Ready to move in!Read more"
65546308,"This is the one you have been waiting for! Recently remodeled penthouse condominium with a private balcony, central AC, and in-unit laundry.  This sunfilled unit offers new windows and door in 2018, an updated kitchen with maple kitchen cabinets, gorgeous granite floors, bamboo floors trough out the rest of the unit, and white trim. The 2 spacious bedrooms are with ample closet space!  Quiet building.  Low Tax and  Assessments, including heat gas water, common insurance, and common area maintenance. Fantastic location 5 mins to Rivers Casino, O'Hare, Rosemont Entertainment District, Chicago Outlet Mall, Rosemont Theater, Restaurants, Close to schools, public transportation, and major highways. Must see***Read more"
110737102,"Ladies & Gentlemen! Your next home is right here! This is that situation where you don't want to hesitate in seeing this gorgeous Home as it will be gone! Call who you need to call to get in here. Picture perfect 3 Bedroom 1.5 Bath Ranch in highly desirable area of Wauwatosa! Close to Shops, Restaurants, & Transportation.  Updated Kitchen, Baths, & Flooring! Appliances Included.  Great Sized Yard and an Attached 1.5 Car Garage. Unbelievable Rec Room offers numerous options for the new owner. Packer Party Dream House! Additional Bedroom/Den can be found downstairs. Peace of mind with the updated Mechanicals. Stop reading this and set that appointment!Read more"
69302229,"Sunny, delightful, compact, beautifully updated 2 bedroom 2 bath townhouse, one of the most private units in the community, located in Civic Center Santa Clara. Walk to Santa Clara University  CalTrain, shopping, Apple new campus, farmers market, and restaurants. Water and Garbage is included in HOA. Slab counters, center island, cherry cabinets, stainless appliances and separate pantry. Bathrooms updated with granite and cherry cabinets also. There is a separate entrance at the back directly leading to upstair bedroom. Move in ready new paint. Attached spotless 2 car garage and cute back yard to entertain and relax. Wonderful opportunity!Read more"
60261285,"Luxurious top floor unit w/desirable view w/hrdwd flr thru-out. Spacious living rm w/large win for natural light, built-in shelving/cabs. Kitchen w/brkfst bar, ceramic tile flr & nice cabs.Newly remodeled bathroom. Full bath w/ceramic tile flr & modern sink. 2 nice sized bdrms w/clst space. Common laundry area & storage area. Great Location, close to schools, park, xpressway. Plenty of guest parking.Read more"
29333062,Sprinkler Sys:YesRead more
26794863,"****OPEN HOUSE!! SUNDAY, September 20th FROM 12-2 PM!!****  Amazing opportunity to buy a great, meticulously taken care of house. The sellers are the second owners and have lived here for about 40 years and have always taken extremely good care of it. It has 3 spacious bedrooms with a large living room, a really big kitchen and dining room combo, as well as 1 and a half bathrooms. The half-bath was recently remodeled and the house also features $11,000 worth of brand new double-pane windows with lifetime warranty.   Virtual Tour on MLS  Hablamos español!Read more"
19556691,"COMPLETELY RENOVATED HOME WITH HIGH END FINISHES. This remarkable home features a master suite, open kitchen concept with quartz countertops, breakfast bar and stainless steel appliances, bathrooms have been beautifully designed, updated flooring throughout, new copper plumbing, tankless water heater, recessed lighting, updated electrical with 200 AMP power, new doors and baseboards, dual pane windows, indoor laundry, smooth finish exterior stucco, finished garage, and an absolutely stunning backyard with mature landscaping and various fruit trees. ADDED BONUS!!!! PROPERTY HAS APPROVED PLANS FOR THIRD BEDROOM AND ACCESSORY DWELLING UNITRead more"
27327034,"Beautiful Home in Carrollton with tons of updates! You will love the huge backyard. Home sits in a cul-de-sac on almost a quarter of an acre. Not only do you have a two-car garage, but also a carport for tons of extra parking. Perfect for RV or boat storage! Home has been freshly painted. Updated Bathrooms. Kitchen boasts modern cabinets, stainless steel appliances, and granite countertops. Newer HVAC and Roof! Brand new windows and patio door will be installed before closing! See transaction desk for full list of updates. So much to love! You will want to call this house HOME!Read more"
26795771,"OPPORTUNITY OPPORTUNITY OPPORTUNItY!!! ATTENTION ALL AGENTS AND HOME BUYERS!! Heres your chance to own a very nice family home or rental. This home offer 4 large bedrooms, 1 large bathroom, a huge living room and kitchen with lots of cabinets and large utility room. This home sits on a nice large corner lot in a well established family neighborhood. Close to schools and all shopping and just minutes from Town East Mall. This Home is priced right and won't last long. CALL NOW!!!Read more"
36721864,"Welcome Home!! Beautifully maintained two level townhome. Updated kitchen/bathrooms, separate dining area, nice sized bedrooms, patio and yard space.Read more"
43695007,"Don't miss out on this rare opportunity to own a well-maintained home in the established Eagle Harbor golf course community- Walnut Creek- where the CDD bond portion has been paid off! This spacious corner lot sits at the front of the cul-de-sac, just a short distance from the children's playground. The home itself features a popular and functional split-bedroom floor-plan with tile floors, new Palladian windows (to be installed), Brand new white tile-like kitchen back splash, fresh paint and landscaping. Upon entry, notice both formal living and dining areas, perfect for entertaining. The foyer will lead to the stunning great room with incredible vaulted ceilings and custom built-ins, tile fireplace, spacious breakfast room, and separate laundry room.Read more"
71488699,"2 for 1 !  Huge horse property close to 3 freeways ! This property offers two single family homes and has space for much more. Completely remodeled in 2018, everything in the interior of the home is new including the A/C on both properties. Main house offers 3 bedrooms and 2 baths.Guest house offers 2 bedrooms and 1 bath with its own kitchen and living room. Great for businesses or multifamily income.Read more"
15072610,"This one-of-a kind 1BR/1BA residence at Pacific Heights Place is located on a coveted block of Vallejo Street among San Francisco's most prestigious homes and historic mansions.  With sunny exposures to the south & west this special corner home looks out to the Golden Gate Bridge & Marin Headlands.  Bamboo flooring, a gas fireplace, generous closets, 1-car parking, and extra storage complete features of this move-in ready offering.  HOA amenities include a sophisticated & welcoming lobby, a community room, sauna, and a dramatic common area roof deck with stunning 180 degree outlooks across the Bay from the bridge to Alcatraz & the East Bay Hills beyond.  Within easy reach of both Fillmore & Union Street corridors (Walk Score 99), enjoy unparalleled access to some of the finest restaurants & shopping the city has to offer.  Perfect as starter home or pied-a-terre, 2295 Vallejo, Unit 309 is a must-see opportunity to own in Pacific Heights - one of San Francisco's premiere neighborhoods.Read more"
29333077,"Remodeled in Woods I of Barton Creek, this is truly one of the most stately and inviting homes on a private estate lot. Beautiful herringbone white oak hardwoods throughout. Clean lines, open and airy. Expanded kitchen with custom cabinetry, quartz counters and professional grade appliances. Must see first floor main primary bedroom with sitting area, en suite bath boasts heated marble flooring, and a massive walk-in closet with built ins. The study has walls of custom bookshelves and cabinets certain to impress. The grand curved staircase which leads to second floor game room with wet bar, fireplace, and second wine refrigerator. Large secondary bedrooms all with walk-in closets. The lush fairy-tale backyard, with plenty of room to play, swim, spa and unwind can be your next entertainment destination.  Optional property owner membership to Omni Barton Creek Country Club conveys. 2020-09-17Read more"
29323270,"Located on a quiet, private street in coveted Travis Country, this immaculate home has a well lit, spacious interior and a picture perfect yard. In-law plan downstairs. Located near hiking and biking trails and just 10 minutes from downtown. Many updates including all new flooring.Read more"
29333063,"This 16722 square foot single family home has 7 bedrooms and 11.0 bathrooms. This home is located at 2401 Portofino Ridge Dr, Austin, TX 78735.Read more"
95060776,"Feel like you live in your own private park in Wauwatosa! This rare home is on 1/2 acre of land abutting private land connecting to the Underwood Creek Parkway! Privacy and loads of indoor and outdoor space to play and entertain in makes this home a dream. Master bedroom has private patio doors that open to a huge deck overlooking the massive backyard. LL with 3rd bedroom currently used as a rec room has full walk out to backyard, driveway and patio spaces. Loads of character, natural light and sunshine in every room, gorgeous hardwood floors, 2 fireplaces, and so much more. Amazing flow for when you have family and friends over.  Attic can be built out or added on to as well as other opportunities.Read more"
3591114,"Here's your chance to buy a home from ""The clean Family"".  The original owners have lovingly taken care of their all-brick ranch-style home and it shows! The first floor has a living room, a kitchen with table space, 2 bedrooms, a full bath with a tub/shower combination, and a dining room which was the 3rd bedroom and can be converted back to a 3rd bedroom and still have room in the kitchen for a cafe table and 2-3 chairs. The exposed hardwood floors are in great shape.  The basement is finished with a large family room and a 1/2 bathroom and feels like a page out of a 1960's sitcom.  The sellers have an automatic interior check valve system - no water in this basement!  Updated amenities include; Roof, Hot Water Heater, Furnace, A/C, Windows, Refrigerator, Front & Rear Exterior Doors, tuckpointing, & a whole home Kohler Brand Generator. The concrete side driveway leads to a concrete block patio, a 1 1/2 car detached garage, and a well-manicured back yard - perfect for enjoying your favorite outdoor activities. The location is desirable! It's a quiet street, great neighborhood and just blocks from public school, parks, stores, and close to the county forest preserve and it's walking and biking path.  Close to all transportation; 1 mile to Metra Train Stop, 3 1/2 miles to the CTA train stop, 1/2 mile to the Pace bus stop, 2 miles to Interstate 294 & Interstate 90 (Kennedy Expressway). This is an as-is sale.  It is NOT an estate, short sale, or foreclosure - just a well-taken-care-of home by the original owners. Make this one the first home you tour today!Read more"
15131932,"This sunny 4bd/2ba residence has perfected the art of staying home with stunning views, a walkout deck, and landscaped yard. Wide sliding doors create a seamless connection between open entertaining areas and the spacious deck. Enjoy breathtaking sunsets over the majestic Twin Peaks while you mingle with guests or unwind. On foggy nights, cuddle up in front of the gas fireplace - the large kitchen is close at hand for a cup of tea, showcasing updated marble countertops & stainless-steel appliances. Hardwood floors run throughout. A flexible layout puts 3 bedrooms upstairs, each with ample closet space. The renovated hall bath features a deep soaking tub & stall shower. Use the lower level as additional living space - visitors will appreciate its separate entrance and direct access to the yard - or indulge in a master suite sanctuary replete with Whirlpool tub, double steam shower, and kitchenette. A sizable office can be used as an additional bedroom or gym. Washer/dryer. 1-car garage.Read more"
63509948,"Great Central location near all. The unit is a very large ground floor functional floor plan. The unit is short walking distance to trolley and freeway near. The Village Walk is gated community with a pool ,exercise room and BBQ.Read more"
26949149,"Gorgeous Open Concept, Fully Updated & Very Functional Layout ! 4 Bedrooms And 3 Full Baths Home With Lots Of Natural Light Giving It A Modern & Elegant Look.Designer Gourmet Kitchen With Quartz Countertops And Stainless Steel Appliances.New Soft Cabinets in Kitchen and Bathrooms.Master With Luxury Bath.Fresh Interior & Exterior Paint.Fully Updated Bathrooms Features Beautiful Tile, Brass Fixtures, Modern Vanities And Neutral Tones. This Gorgeous Home Has All New Luxury Flooring,New Fixture,New Extra Large Garage, Electric Fence Gate And Much More  !Large Backyard. Walking Distance To Schools, Restaurants, Shopping & Major Freeways. MUST SEE !!.Read more"
29475480,"Welcome Home to this quaint gated community with an unbeatable location.  Off Mopac with easy access to 290 and 71 and 360, close to Southwest Parkway, greenbelt, shopping and dining districts.  Home is in amazing school district along with the close proximity to private schools in area.  Spacious 2 story, 3 bedroom home, 2 dining spaces, 1 large formal living with a fireplace.  You have a new roof and new paint on exterior and new Pergola outback. Come take a look, homes in this community dont last long.Restrictions: Yes  Sprinkler Sys:YesRead more"
68978645,"This Large Family home was built in 2005 with over 3,000 square feet of living space featuring 4 Bedrooms and 4 bathrooms. Two of which are Master Bedrooms each with their own Bathroom. The other 2 bedrooms share an oversized Jack and Jill bathroom. All bedrooms are upstairs. Downstairs has Tile flooring throughout in the Living room, dining room, family room, kitchen and bath. The kitchen has lots of counter space with granite counters and stainless steel appliances. There is plenty of room for entertaining your guest and enjoying all the amenities this wonderful home has to offer.  Park 4 cars behind the front rolling gate and additional parking available behind the Pass Thru 2 car Garage. Plenty of Privacy due to Cul-De-Sac like Location. Block wall surrounding the property with many mature plants and trees. This home also has a studio in back yard. This home is a must see located near South Pasadena.Read more"
2136248651,"Updated 2nd floor condo in great central location. Excellent access to major expressways. Real hardwood flooring in Kitchen, Living/Dining Room, Hallway. Newer windows and doors (soundproofed). Granite counters in Kitchen and bath. Ceramic tile floor in bath and newer commode. Newer laminate flooring in 2nd bedroom. Newer deck. All appliances stay! Newer white wood blinds!  2 parking spaces. 2 good sized storage units #s 164 & 117.  Complex has a work out room and a small pool for the summer.Read more"
121067648,"DO YOU WANT ""PEACE AND QUIET"" BUT ALSO QUICK ACCESS TO DOWNTOWN? YOU'VE COME TO THE RIGHT PLACE! WESTHAVEN PARK IS CONVENIENT TO EXPRESSWAYS, PUBLIC TRANSPORTATION AND BUSINESSES ALONG WESTERN AVENUE YET PROVIDES A CALM NEIGHBORHOOD ATMOSPHERE WITH PLENTY OF PRIVACY! GROUND-FLOOR CONDO HAS LARGE LIVING/DINING ROOM, GRANITE/STAINLESS KITCHEN WITH 42"" CABS, HUGE TERRACE WITH PLENTY OF ROOM FOR GARDENING. BEDROOM HAS BRAND NEW FLOORING AND WALK-IN CLOSET THAT'S ""CALIFORNIA CLOSET"" READY! RECENTLY IMPROVED WITH ACCORDIAN BLINDS IN L/R AND B/R AND BRAND-NEW WATER HEATER. UNIT IS VACANT AND WILL BE CLEANED AND DISINFECTED BEFORE CLOSING. SEE IT - LOVE IT - BUY IT!Read more"
89667847,"Beautiful custom-built home with lovely city views. Fantastic location bordering South Pasadena and just minutes away from Downtown Los Angeles. The home has 4 bedrooms, 3 baths and an office/den area that could easily function as a 5th bedroom. The living room has soaring ceilings, hardwood floors and a fireplace perfect for holiday gatherings. The living room opens up to the dining and gourmet chef's kitchen featuring stainless-steel appliances, granite countertops and elegant porcelain tile floors. Upstairs you will find the spacious master suite that has its own private balcony allowing beautiful panoramic views and sunsets. Large master walk-in his and hers closets and expansive master bath featuring a double sink vanity with granite counters and Tuscany beige travertine tile throughout. Add your own personal finishing touches and make this home your own.Read more"
