house_id,overview
20797583,"Think of the possibilities... to be able to reimagine this 1 bedroom Hollywood Hills Cottage off the famed Laurel Canyon. Add a bedroom and bath, do a total remodel, or a rebuild as there is ample land to be used with a good sized side yard and a bit of a backyard next to a rear hillside. Newer roof and painted exterior a few years ago. Good bones, just needs someone creative to make it a perfect pied de terre, or create something brand new.Read more"
19607696,"This 1554 square foot single family home has 3 bedrooms and 2.0 bathrooms. This home is located at 221 Tyler Ave, Santa Clara, CA 95050.Read more"
158778443,"Beautiful single family home in Near West Side/West Loop.  This classic 3bed/2.5 bath row home has been meticulously maintained over the years.  New windows, new and refinished flooring, tuck pointing, new roof coating, updated plumbing and electrical, new Therma Tru front doors and much more!  First floor boasts grand foyer and staircase, classic vintage parlor style front room with original parlor doors.  Space for separate dining area off the kitchen, huge office (perfect for working from home), as well as a library/second sitting room with an adjacent half bath.  Extra wide hallway and spacious bedrooms upstairs including two full bathrooms.  Unfinished basement allows for plenty of opportunity to gain additional living space or has potential for an in-law suite with a separate entrance!  Rounding out this amazing home is the lush backyard garden which you can enjoy from either of the two large back decks.  Bring your buyers, this won't last long!Read more"
27290268,"Wonderful home in great location.  Spacious 3 bed, 2 bath home with 2 living and 2 dining areas.  Open floor plan with high ceilings.  Conveniently located near shopping and restaurants with easy access to major highways.  Repairs and updates performed in 2019 include roof replacement, foundation repair, fresh paint throughout interior and all flooring replaced.  This one won't last long.Read more"
458486,"Huge, 2 Bedroom Basement Apartment with Unlimited Off Street Parking, Bright,High Ceilings, Spacious Floor Plan, Full Kitchen, Washer/Dryer, Includes All Utilities, Cable TV, Wireless Internet.

Includes all Utilities, Cable TV, Wireless InternetRead more"
36744362,"BACK ON MARKET FOR BACK UP OFFERS! SUBJECT TO RELEASE OF CURRENT CONTRACT IF NOT SETTLED BY 10/14/20! Home Sweet Home! Cozy rambler situated with on almost half an acre.  Spacious.... open kitchen with island & breakfast nook, living room, large family room with double fans and access to deck.  Entertaining will be a breeze whether it's inside, on the large deck, or backyard. Backyard is open, level, and fully fenced. Backs to trees allowing for privacy. Home has been freshly painted...and is move in ready!  No HOA! A short drive to shopping, dining, theaters, restaurants and more! Better hurry....this one won't last long! PLEASE READ AGENT REMARKS!Read more"
55396371,"Showings start 10/3-VRP $565,000-639,000. Located in the heart of the desirable Tenney Laphan neighborhood, a half block to Tenney Park and Lake Mendota. This 4 bedroom, 2 1/2 bath is turn key, move in ready and has been meticulously maintained. Large addition in 2010. Seller spared no expense to maintain the classic Prairie/Craftsman style home. Red oak trim, oak hardwood floors throughout. Quarter sawn oak cabinets and quartz countertops in the oversized gourmet kitchen. Butlers pantry includes main level laundry area.  Custom touches abound such as central vacuum, laundry chute and built-in cabinets.  One car garage with an off street parking slab behind the house that can double as a patio!  Close proximity to the best Madison has to offer; bike trails, festivals, lakes, and much more!Read more"
27263280,"Come see this cute 3-2-2 located close to George Bush and Hwy 35. Master suite has a sitting area or office space and a large walk in closet. Updates include Oiled bronze plumbing and light fixtures, appliances, flooring, fresh paint inside and out and lots more. Enjoy a great backyard with a big patio for entertaining.Read more"
55397047,"Affordable all brick ranch in Downtown Madison! Priced for condition, will need TLC and updating; but what a great location! Three bedrooms, wooden floors, screen porch, decent sized back yard. No garage or driveway, but plenty of street parking available. Walking distance to numerous local bars & restaurants, newer hot water heater and boiler. Great opportunity to stop paying rent and own your own home in Downtown Madison! Property sold as-is.Read more"
15181623,"Stunning 3-level residence featuring 4 bedrooms, 3 bathrooms, open and dramatic living spaces. On the expansive main level the kitchen, dining room, living room, and deck flow together to create gathering areas for casual daily living and formal entertaining. Kitchen and dining room skylights infuse the space with light. Classic architectural elements - parquet floors, vaulted ceilings, and a fireplace add elegance and character. From the living room step out to the deck and enjoy sweeping City views plus the mature garden below. 2 bedrooms and 1 bathroom complete this level. The generous primary suite with 2 walk-in closets, and extraordinary views provides a peaceful retreat. The lower level houses a family room with garden access, handsome built-in storage, a wet bar, and 1 additional bedroom and bathroom. Perfectly situated across from Douglass Playground & Dog Park. This special Noe home presents an opportunity to surround yourself with urban sophistication in a serene environmentRead more"
17112626,"Beautifully upgraded home, move-in ready! This home features all new luxury vinyl flooring throughout. Gorgeous kitchen with brand new cabinets, quartz counters,  and stainless steel appliances. Freshly painted inside and out! Enclosed patio room off the living room for relaxing. Large private yard to make your own! Hurry this home won't last long!Read more"
19599402,"OPEN BY APPT. -- Beautiful expanded home on one of the best streets in the sought-after Northgate Neighborhood facing east.  Most of these homes are 3BR, 2BA, 1,340 Sqft.  This home was expanded by the current owner (with permits) to 1,654 sqft. giving it an expansive family room leading to the entertainment friendly backyard and allowing for an enlarged spacious master bath.  Seller owned solar, zero electric bill for home and car. Private office with door off family room, perfect for work at home. Own in one of the best neighborhoods in Santa Clara. Centrally located to Apple Park, New Google Campus, Santana Row, Major employers. 8-acre public park with pool, tennis and basketball, only a few minutes away without driving.Read more"
7506397,"A large new built home has 4 bedroom and 2.5 bathrooms with stainless appliances, Quartz counters, open concept,large kitchen island,pantry,ceilings,upgrade window coverings,Vinyl plank flooring,walk in closet and double sinks in master bedroom. Garage has 16 x 8 ft. door.Whirlpool   Dish washer, Microwave and Range will install  before close of escrow.Read more"
2077871631,"Schiller Park! Beautifully updated 2 bedroom condo located near O'Hare. This units offers an open living room and kitchen area with ceramic tile floors. All stainless steel appliances including a dishwasher and built in microwave. Large kitchen island with granite countertops, undermount sink and plenty of counter space. Updated bathroom with jacuzzi tub and ceramic tile floor. 2 nice sized bedrooms with custom built in closets and drawers. In unit laundry and 2 parking spaces included along with 2 storage units. One of the storage closets is conveniently located in the front hallway outside of the unit. Building offers a pool and workout facility. Close to all transportation, shopping and entertainment.Read more"
20802252,"Perched above Sunset Blvd. in the heart of Mount Olympus is a 3 bed, 3 bath, 2,720 sq. foot home situated on the lot of your dreams!  Perfect for an investor, developer or end user, the home is ripe for a renovation or addition. With 157 ft. of frontage, the massive two parcel lot offers unlimited potential. Open the doors to a bright and spacious living room with high ceilings providing easy access to the dining/kitchen area, as well as the expansive backyard via elegant French doors. Retreat upstairs to a spacious master suite featuring a fireplace, large en suite bath with sauna and generous his and her closets. Imagine the possibilities to transform this space located on one of the most unique lots in the neighborhood having two parcels. Mount Olympus is an ideal location, offering a level of security, privacy and access that is unparalleled.Read more"
26817089,"Vey well maintained property, just 10 minutes from downtown. Home has a huge backyard! Big driveway for big vehicles. New roof, carpet, flooring, interior and exterior paint. Transferrable lifetime foundation warranty. Lots of potential for expansion. Come see this home before its gone!Read more"
20802736,"Highly upgrade gated single story pool home with lots of privacy on a large mostly flat lot. 3 bedrooms and 3 bathrooms in additional to a large living and family room/den adjacent to a formal dining and office / studio. Desirable features including heated bathroom floors, Miele appliances, black faced sub zero refrigerator / wine cooler, hardwood floors, raised beam ceilings, 3 fireplaces, and generously sized windows perfect for enjoying the valley views and a large patio area. Huge private backyard with heated pool with spa and a large flat grassy area with mature landscaping. 2 car garage in addition to a secured courtyard parking for up to 10 cars. *** Short term lease considered ***Read more"
20690665,"Home Sweet Home. Come see the potential of this great corner lot. Wonderful opportunity for developers. Intersect with two cul-de-suc streets. Must see to appreciate! Airy and bright. There are green belt hilly views from the master Bedroom and Breakfast area. A Gem in the rough yet the house inside is livable. There is a 400 sq. ft. basement, with windows and 3./4 bathroom with its own entrance.  Fruit trees, and passion fruits vine surrounding the house. 5 car ports, Quiet area yet minutes from shopping, downtown and South Pasadena. House can be delivered furnished for additional cost.Read more"
125235199,"Modern design. Great investment property. Great location. Easy access to 35, George Bush and 121.Read more"
19599061,"COME HOME to your classic ranch retreat! Half a block from the neighborhood organic market in the middle of beautiful Santa Clara, you'll benefit from quality Santa Clara schools.  You'll have more avocados than you can ever eat from the huge tree in the cool newly landscaped backyard. The ample lot provides opportunities for expansion of the home.  Newly refinished red oak floors original from the 1940s await your arrival.   As well,  this home boasts a new kitchen floor, newly painted lath and plaster walls. The original heating system was updated to a forced air system.  As well, the electrical service panel was updated.  Dual pane windows have been installed throughout except in two locations of the home's living space.  This is one of the last homes in the Old Mission Tract to retain its octagonal guest closet window in the entry. The new landscaping was installed with automatic sprinklers.  Washer and dryer in the garage are included. Termite and roof reports are provided. Lot and living area size and year constructed are from public record: buyers to verify these and all representations.  Buyer to verify schools in the listing. Room for RV parking on right side of home with wide double gate admitting entry to back yard.Read more"
110717469,"Welcome home to your completely updated colonial in desirable Ravenswood neighborhood. This entire home will captivate you with it's character and updated style while maintaining its original charm. Rich stained hardwood floors, original crown molding and beautiful white trim throughout.  Modern KIT features white cabinets, subway tile backsplash and gleaming porcelain tile flooring. Attention to detail is evident within the 2 remodeled baths. Plenty of space to relax with a finished rec-room,  3-season porch or in the private back yard with a new brick patio and cedar fence. Newer plumbing, electrical, siding, roof and more. See full list of updates!Read more"
3591619,"This 1000 square foot single family home has 3 bedrooms and 1.0 bathrooms. This home is located at 9844 Montrose Ave, Schiller Park, IL 60176.Read more"
61122245,"STUNNING! This Capitol Point beauty is a MUST SEE! Tastefully and artistically transformed. Chef's kitchen with induction cook-top, new refrigerator, dishwasher, wine refrigerator, cabinetry, counters, built-ins, reconfigured floor plan, new flooring, light and bright, huge windows, new blinds, new heat pump system and so many wonderful extras! Association fee also includes water, sewer, greatly discounted internet and cable. Fabulous downtown location...a block off the Square. Professionally managed well run Association.Read more"
26816793,"Perfect starter home in an established neighborhood! This 2 bedroom 1 bath is ready for a new owner to move right in! Large windows in the living room offers plenty of natural light for family gatherings. Step into the kitchen where you'll find granite countertops, double sink and an abundance of cabinets for storage. Updated bathroom and fixtures. Large bedrooms with ample closet space. Enjoy the large fenced in backyard that would be great for entertaining. Extending driveway offers plenty of extra space for parking.  A must see!Read more"
83239335,"Showing start 8/21 at 12pm. This character filled top floor corner unit in The Colony has it all. Meticulously maintained 2 bedrooms + 2 baths sunny unit has an open floor plan with hardwood floors, brick walls and cozy gas burning fireplace. Kitchen offers granite countertops, stainless steel appliances, gas range, new microwave and tiled backsplash. Master bedroom ensuite has large walk-in closet and walk-in shower. Private terrace has Capitol view. In-unit washer and dryer, storage unit located on same floor as unit and 1 heated attached parking space. Parking #28, Storage #920Read more"
17044002,"Updated single-story home in Lemon Grove! ***Bright and open living area with vaulted ceilings, handsome fireplace, and a large window seat. ***Modern kitchen with newer stainless steel appliances, large breakfast bar, and tons of cabinet and countertop space. ***Spacious dining area with a large glass slider leading to the backyard. ***Serene Master bedroom with a large closet and ensuite bathroom. ***Relax and soak in the beautiful sunsets in the private backyard with two decks, retaining wall, and mature fruit trees. ***Detached 2-car garage and RV space including 40 amp power, water hook-up, and cleanout. ***Great, central location! Walk to the local schools, restaurants, stores, and brewery.Read more"
36721173,"BEAUTIFUL SPLIT LEVEL IN BRIARWOOD, BOAST  5 TOTAL BEDROOMS, AND 3 FULL BATHROOMS, RECENTLY REMODELED GOURMET KITCHEN WITH STAINLESS STEEL APPLIANCES, RECENTLY PAINTED,  NEW CARPET IN LOWER LEVELS. THIS HOME HAS 4 LEVELS 3 BEDROOMS UPSTAIRS AND 2 ADDITIONAL DEN ROOMS IN THE LOWER LEVELS. HOME AS HUGE BACK YARD. SWIMMING POOL DOES NOT CONVEY, ALL VEHICLES IN YARD WILL BE REMOVED PRIOR TO BUYER OCCUPYING HOME. VYNAL FLOORS TO BE INSTALLED IN LAUNDRY ROOM.Read more"
61122536,"Metropolitan Place! Immaculate 12th floor condo located in the heart of Madison! Beautiful split bedroom design w/open floorplan, wood floors throughout, & private balcony w/soaring courtyard views & the downtown skyline. Kitchen features stainless appliances w/gas range, under cabinet lighting, granite counters & breakfast bar. Bright living rm w/tall ceilings & gas fireplace w/granite surround. enjoy a meal at the cozy dining area or the elevated breakfast bar. Main bedroom features a walk in closet. Spacious bathroom w/tile flooring & jetted tub. Additional features include private in unit laundry (washer & dryer included). Two side by side underground parking stalls & storage unit included. Metropolitan Place offers an amazing central downtown location & excellent amenities.Read more"
27263190,"Open House Sunday 1-3 $5000 toward closing or improvements. Clean and move in ready. Cute home with great floor plan as shown in photos.  Located in Kingspoint subdivision of Denton County.  3 bedrooms, 2.1 bath and 2 livings areas.  Nice size family room leading into kitchen with pantry, electric range and built in microwave.  Lots of cabinets. Arcadia doors lead to big backyard with storage and yard is flat.  Upstairs includes a  15 x 20  master bedroom with room for a sitting area. Huge walk in closet.  Master bath has two level, double vanity.  Two HVAC systems. Ancillary rooms are good sized. Rear of home faces Northwest. Recessed lighting in most areas and ceiling fans throughout. No survey available.Read more"
110714834,"Enchanting Swan Park brick colonial packed with character, style and space.  Winding front walk lined with beautiful boxwoods. French style windows, arched dormers and gorgeous iron window boxes. Original hardwood floors, a stone natural fireplace, plaster moldings and arched openings.  DR has original built-ins and access to bonus family room with original brick wall, bead board ceilings, patio door and full bathroom with walk-in shower.  KIT is spacious, center island, high end SS appliances, white cabinetry and granite counters. Upstairs are 3 nicely sized bedrooms and second full bathroom. Master has access to a second floor deck, the perfect place to relax or work from home!  LL is partially finished has third full bath. Backyard is private, featuring a patio as well as green space.Read more"
7515762,GREAT INVESTMENT PROPERTY! Lot of potential and long-term tenant in place who  would love to stay. Home can be flipped and sold for possibly $210-220k !!Read more
110745460,"Swan Park Neighborhood brick colonial beauty!  Attractive curb presence with beautiful curb appeal.  Enter this welcoming home with lots of room to entertain family and friends.  Classic natural fireplace in living room, dining room with built-in china cabinets and everyday living made easy with a remodel in 1998.  All 3 bedrooms are conveniently located upstairs with a full bath. Lots and lots of storage!  Enjoy the GORGEOUS backyard with lots of privacy and nice canopy to enjoy those picnics outside.  You will not be disappointed.  Come check it out! Home Warranty is also included!Read more"
111710774,"Super fun location, 233 Franklin St, Res.303, located in the center of vibrant Hayes Valley, where yummy restaurants, boutique shopping, theater/opera, & downtown are at your doorstep. This luxury 2bed/2bath condo is a gracious 1,345sqft & situated on a corner with tons of natural light from both directions.  The chef's kitchen would delight any cook with its imported Studio Becker German craftsmanship cabinetry, Walker Zanger tile backsplash, & Italian Bertazzoni/Fisher+Paykel appliances. The open space living with bold ebony-stained hardwood floors is perfect for entertaining or relaxing/taking in the Hayes Valley vibe/views downstairs. Primary bedroom ensuite is large enough for a king bed & has floor/ceiling windows, a spa-like bathroom with a soaking tub, & separate modern shower, surrounded by custom tile work. Your own EV charger & large storage unit. Living here is steps away from coffee at BlueBottle, ice cream at Salt&Straw, wine at Arlequin & dinner at Rich Table or aManoRead more"
43693622,"Come live in one of Fleming Islands most desired neighborhoods, HABERSHAM HARBOUR.  This community is sought after for its private boat ramp to Doctors Lake, storage for your boat or RV, community pool and tennis court, mature trees and custom homes. 
This charming home offers 4 bedrooms and 3 bath plus loft. Backs to preservation of over 8 acres. Park like back yard with enclosed back patio. Large custom kitchen with ceramic faux wood tile and 2 way fireplace into the family room. Master downstairs along with 2nd bedroom, 2 large bedrooms with Jack and Jill bath, and bonus room upstairs.  Home has many upgrades including new custom kitchen island, remodeled two way fireplace with wrapped brick, granite counter tops in kitchen, remodeled shower/bath, plantation shutters, outdoor pavers with fire-pit, gutters with french drain, oversized garage with above attic storage.  This Immaculate home has a freshly painted interior and is turn key ready for immediate move in.  Read more"
89028797,"Private casita California Spanish style living in renovated home featuring 2 bedrooms and 1 bath. Front yard is enclosed with tall wooden fence creating a place of tranquility midst plants, ivy and bird bath. Large bougainvillea flowers attract hummingbirds, finches, and butterflies. The home sits on a corner lot, tall windows and high ceilings are filled with natural light pouring into the open living concept living room, kitchen and dining area. The 2 bedrooms are separated from the main room located toward the back of the house separated by a hallway, allowing for additional privacy when entertaining. Separate access door at side of home opens up to laundry area and back patio.  Steps to upper level terrace lead al fresco dining spacious for grilling, entertaining or relaxing.  View of Ascot Hills, neighboring Alhambra and South Pasadena. Near shopping, DTLA, and cultural venues. Central air and heating,recessed lighting, crown molding, ceiling fans, wood laminate floors.Read more"
96794753,This Stunning Brick Cape Cod offers tons of living space in a desirable neighborhood. Impressive Main floor featuring Living Room/Dining Room Combo with updated flooring and fresh paint throughout  Relax in the 4 season room that overlooks your fenced-in backyard. Upstairs you will find the Large Master bedroom & a walk in closet with an adjoining loft area that is perfect for an office space. Lower Level is Partially Finished with a storage area that has laundry facilities & work-bench! Long Side driveway leading to 2.5 detached garage and storage shed!Read more
20641954,"Welcome to this charming 2 bedroom, 1 bathroom on the top of the Chadwick Dr! This wonderful home sits on a large lot with plenty of potential for expansion. The kitchen has been recently updated with new cabinets and granite counters, all the appliances are new and come with the home. The bathroom is light and bright with stone and tile finishes and new fixtures! The front living room has a beautiful fireplace perfect for a cozy night. Enjoy the front yard in the evening and take in the city lights as this property is high on the top of the street with a peek a boo view from the front yard.     This property is central to DTLA with short commutes to other surrounding areas and city night life, come see this one.Read more"
7500794,"This is a very unique opportunity. The County Zoning is (C-G), Commercial General, The City Zoning is (C-3)Commercial and General  Commercial. It has been used as a residence and the tax bill shows it is a residential parcel as the ''property type'' and ''legal class''. There is an alley access to the property in back. It is located very close to I-17 and frontage road. The main house is 1626 square feet with 4 bedroom and one bathroom.There is a separate quest quarters in the back yard that is 495 square feet, with one bedroom, one bathroom, living room, kitchen and dining room.Some of the plumbing has been removed from the main house from the laundry room as well as the swamp cooler. Therefore, this will be sold in as-is condition with cash only (no loans).Read more"
26798388,"BRAND NEW AND Just minutes away from the heart of the city! The interior of this home exudes an atmosphere of warmth and coziness. Highlights include a large family room with excellent natural lighting, a fully equipped kitchen that showcases stainless steel appliances, granite counter tops and more. Large master bedroom, walk in closet and the master bath has and walk in shower with sitting area. This house is a must see.Read more"
17017506,"This 1550 square foot single family home has 3 bedrooms and 2.0 bathrooms. This home is located at 7452 Brunei Ct, Lemon Grove, CA 91945.Read more"
110701630,"Near Mayfair Mall, the Zoo and Froedtert hospital.  Remodeled kitchen and main bathroom. Newer appliances, washer, dryer.  Very well maintained yard.    Also a three season room and patio.Read more"
64969813,"City living at its finest in this luxury modern building that embodies qualities of both classic urban architecture and modern design. Stylish 2 bedrooms-2 baths condominium offers custom bedroom wall closets, maple cabinetry, granite counters, limestone bathroom floors, in unit W-D hookups, surrounded by high-tech wiring and designated deeded storage. Relax on your balcony and enjoy the city views. Private courtyard with bbq grills, conference room, gym, fitness studio with classes and secured room for all your package deliveries. Centrally located in the heart of the City's cultural hub with theaters, symphony, opera and ballet. Hayes Valley and Valencia Corridor chic shops and restaurants to satisfy all palates nearby. Easy access to freeways, public transportation and tech shuttle buses right at the front door. This is your home with everything you need within your reach!Read more"
